Number,Year Erected,Marker Name,Marker Text,Civil War Site?,Location,Latitude,Longitude,Mapped Location
164,2018,Antioch Pike,"The Mill Creek Valley Turnpike Company was incorporated by the Tenn. Gen. Assembly on Jan. 21, 1846. Starting near the four mile mark of Nolensville Pike, the road went through Mill Creek valley, “crossing main Mill creek at or near Rains’ mills, passing Antioch meeting house” and continuing south. Tollbooths could be established every five miles to pay for the completion of the road. The name was changed to Antioch Pike in October 1928.",,2360 Antioch Pike,36.06097,-86.674603,POINT (-86.674603 36.06097)
118,2004,Sunnyside,"Home of Mary Benton, widow of Jesse Benton who left Nashville after a famous feud with Andrew Jackson in 1813. The Greek Revival house was built c.1852 and stood between Union and Confederate lines during the Battle of Nashville in 1864. Prominent dentist L.G. Noel lived here for 45 years. The brick wings were added by Col. Granville Sevier during renovation of the house in the late 1920s.",,"Sevier Park
3000 Granny White Pike",36.119859,-86.790745,POINT (-86.790745 36.119859)
238,2021,Lynching of Samuel Smith,"The last known or recorded lynching in Davidson County took place in 1924 near this site.  Around midnight on December 14, 1924, a mob of at least six armed, white, masked men entered Nashville General Hospital and abducted Samuel Smith, age 15.  The men quickly identified Smith, who was in police custody and chained to his bed.  Nurse Amy Weagle attempted to hide the chain in an effort to thwart the abduction.  In the early hours of December 15, the mob drove Smith to Frank Hill Road, now Old Burkett Road, near the site of the alleged robbery and shooting that led to his arrest.  The mob stripped Smith of his pajamas, hung him from a tree with a thin rope, and shot him multiple times.  Despite a grand jury investigation, public outcry and a reward offer in local newspapers, no one was ever arrested, charged or held accountable for the murder of Samuel Smith.  This act of racial terror was meant not only to punish Smith for his alleged crimes, but to intimidate the local African American community and reinforce the racial hierarchy through violence.  Though passed down for generations in the community, this story has now been spoken of openly in an effort toward reconciliation.",,7236 Old Burkitt Road,35.992527,-86.68273,POINT (-86.68273 35.992527)
24,1970,Lockeland Spring,"Located 250 yds. S.E., this famous pioneer spring served Lockeland mansion on site of present school building. Home built by Col. Robert Weakley in early 1800’s and named for his wife, daughter of Gen. Matthew Locke of Salisbury, N.C. Spring water won prize at St. Louis Exposition in 1904, for its “unique mineral composition and salubrious quality.”",,corner of Woodland Avenue and North 17th Street,36.176942,-86.739568,POINT (-86.739568 36.176942)
189,2019,Dr. Matthew Walker Sr.,"Matthew Walker was born December 7, 1906 in Waterproof, La. After attending school in New Orleans, he graduated from Meharry Medical College in 1934 and began teaching at Hubbard Hospital. Walker served as Chairman of the Department of Surgery from 1945-73 and was instrumental in securing a 1968 federal grant to start the Meharry Neighborhood Health Center. In 1970 the community-based clinic’s name was changed to the Matthew Walker Comprehensive Health Center in his honor.",,1035 Fourteenth Avenue North,36.170705,-86.801482,POINT (-86.801482 36.170705)
23,1970,Cumberland Park,"The Cumberland Fair and Racing Association sponsored harness racing here 1891-1894. The great match race between Hal Pointer of Tennessee and Direct of California occurred Oct. 21, 1891. Direct won all three heats in record time for a pacing race. Arion, Directum, Kremlin, Robt. J. raced here. Running races 1893-1906 preceded the State Fair 1906.",,"State Fairgrounds, intersection of Walsh Road, Rains Avenue, and Wedgewood Avenue",36.132763,-86.764927,POINT (-86.764927 36.132763)
47,1971,Saint Cecilia Academy,"The name Saint Cecilia, patroness of music was chosen for a grammar and high school for girls, opened in October 1860 by four sisters who had moved to this site from Saint Mary’s convent, Third Order of Saint Dominic, Somerset, Ohio on August 17, 1860. The central building was completed in 1862, the west wing in 1880, and the east wing in 1913.",,Dominican Drive near Athens Way,36.187542,-86.800194,POINT (-86.800194 36.187542)
124,2007,First Baptist Church East Nashville,"Founded in 1866 under the direction of Rev. Randall B. Vandavall, First Baptist Church East Nashville built. This Classical Revival building between 1928 and 1931, during the height of Rev. W.S. Ellington’s career. Nashville artist Francis Euphemia Thompson painted the distinctive baptistry murals in the 1950s and 1960s. At that time the church served as a frequent meeting place for the African-American community during the Civil Rights Movement.",,601 Main Street,36.1739,-86.762598,POINT (-86.762598 36.1739)
82,1982,Oglesby Community House,"Built 1898, the Mary Lee Academy, the second school in the Oglesby Community, was named for its first teacher, Miss Mary Lee Clark. The county bought the school in 1906. The name changed to Ogilvie in honor of the land donor, Benton H. Ogilvie, and later became Oglesby. In 1943, the schoolhouse was given back to the Oglesby Community.",,5724 Edmondson Pike,36.03777,-86.743381,POINT (-86.743381 36.03777)
193,2019,Club Baron,"Jefferson Street developed as a vibrant African-American commercial district in the late-19th and early-20th century.  As Fisk University, Tenn. A&I (Tenn. State Univ.) and Meharry Medical College grew, more restaurants, shops and music venues opened to cater to nearby residents. Built in 1955 during the golden age of Jefferson Street’s music scene (1935-65), Club Baron is the only extant nightclub from that time. Owned by local pharmacist Jackson H. Brown, the building also 

served as a secondary location for Brown’s Pharmacy, as well as the only skating rink in town for African Americans.  The club is best known as the site of a 1963 guitar duel where Nashville bluesman Johnny Jones bested up-and-comer Jimi Hendrix. Other well-known performers included Fats Domino, Etta James, Little Richard, Otis Redding, Muddy Waters, Jackie Wilson and Ruth McFadden. Now owned by the Elks Lodge, the building was preserved as a local Historic Landmark in 2016.",,2614 Jefferson Street,36.168062,-86.818085,POINT (-86.818085 36.168062)
30,1970,Old Hickory Powder Plant,"Site of the $87,000,000 Old Hickory Powder Plant built and operated in 1918 by the E.I. DuPont deNemours Co., for the United States Government, to make smokeless gunpowder for the Allied Armies in World War I. By the time of the Armistice Nov. 11, 1918, the plant, 75% complete, was producing 750,000 lbs of powder every 24 hours.",,"Swinging Bridge Road and Cinder Road, Old Hickory",36.276917,-86.6691,POINT (-86.6691 36.276917)
61,1975,Nashville Academy of Medicine,"The Nashville Medical Society, the first medical association in Tennessee, was founded March 5, 1821, by seven physicians in the log courthouse on the Public Square. The first president was Dr. Felix Robertson (1781-1865), son of James and Charlotte Robertson and two-time Nashville mayor. On September 4, 1906, the organization was chartered by the State of Tennessee as the Nashville Academy of Medicine and Davidson County Medical Society.",,111 33rd Ave N,36.140972,-86.816986,POINT (-86.816986 36.140972)
53,1975,Frederick Stump 1724-1822,"Frederick Stump, an early settler in the Fort Nashboro area came from Pennsylvania by way of Georgia.  He was a Revolutionary War soldier & noted Indian fighter.  He owned a large plantation along White's Creek where he operated a mill & inn & rented land to other settlers.  This log house is said to have been his home and inn.",,4949 Buena Vista Pike,36.232122,-86.825096,POINT (-86.825096 36.232122)
41,1971,First Steam Locomotive,"On Dec. 13, 1850, the first steam engine, Tennessee No. 1, ordered by the Nashville & Chattanooga Railroad arrived at the wharf on the steamboat Beauty, from Cincinnati. The one mile trip on improvised track from the wharf to the S. Cherry St. crossing required 4 days by mule power. A one mile run was made from this point on Dec. 27, 1850.",,Fourth Avenue South railroad crossing at Hart Street (Dudley Park),36.142497,-86.765044,POINT (-86.765044 36.142497)
201,2019,Turner Grammar School,"By 1800 Whitsett’s Chapel became this area’s first school.  In Jan. 1899 Flat Rock native, philanthropist and real estate developer R.W. Turner and wife Sallie W. Turner gave 2 acres for a new 9th dist. public school.  The first Turner School was overcrowded by the 1920s.  Designed by architect George D. Waller, Turner Grammar School opened in 1926 with Otto Prather as principal.  The cafetorium dates to 1950.  An annex of Cole Elem. in its final years, the school closed in 1989.",,2949 Nolensville Pike,36.108327,-86.743958,POINT (-86.743958 36.108327)
99,1996,Lake Providence Community,"Soon after the Civil War, freed slave families established farms and dairies in this community named for Lake Providence Missionary Baptist Church. The church was founded in 1868 by Rev. Larry A. Thompson, a traveling missionary. The first church building and school stood nearby. Many roads in this area are named for African-American settlers.",,4500 block Nolensville Road,36.071553,-86.72389,POINT (-86.72389 36.071553)
77,1982,Fall School,"Fall School, built in 1898, is the oldest public school building remaining in Nashville. Named after Mr. P.S. Fall, a prominent Nashville businessman and member of the Board of Education from 1865-1867, it served as an elementary school until 1970. In 1982 it was privately renovated for offices. Unlike the earlier study hall design, Fall School had individual classrooms.",,1116 Eighth Avenue South,36.141902,-86.778561,POINT (-86.778561 36.141902)
66,1976,Cornelia Fort Airport,"Cornelia Fort (1919-43), Nashville’s first woman flying instructor volunteer, Army’s WAFS, WWII, was the first woman pilot to die on war duty in American history. “I am grateful that my one talent, flying, was useful to my country.” she wrote shortly before her death. Miss Fort was lost in a crash over Texas flying a basic-trainer plane, BT 13-A, across the United States.",,"Cornelia Fort Airport, Airpark Drive",36.190367,-86.70405,POINT (-86.70405 36.190367)
246,2022,Kurdish Americans in Nashville,"In 1976 Kurdish immigrants began arriving in Nashville and continued to emigrate here, fleeing persecutions in Iran, Iraq, Syria and Turkey where they were ethnic minorities following the Treaty of Lausanne. In 2022, around 20,000 Kurds lived in Nashville, the largest Kurdish community in America. One of the first Kurdish mosques in America, the Salahadeen Center of Nashville was founded in 1998 and provides religious, educational and social services to the local Muslim community.",,,,,
59,1975,Battle of Nashville Federal Main Line,"On Dec. 16, 1864, the Federal 16th Corps under Gen. A.J. Smith joined the 23rd Corps under Gen. John M. Schofield approx. 1000 ft. north of here. From that line at about 4:00 p.m. the 1st Brigade of Gen. John McArthur’s 1st Division launched the assault that broke the Confederate line at the salient on Shy’s Hill to the southeast which resulted in the rout of Hood’s Army.",X,Harding Place at Compton Trce,,,
85,1990,Vine Street Temple,"Nashville’s Jewish community began in the 1840s. Many early families were immigrants fleeing oppression in Germany, Russia, and Poland. Completed in 1876, the Vine Street Temple, with nine Byzantine domes was Nashville’s first synagogue, for 80 years a symbol of the city’s strong Jewish presence. In 1955, the Reform congregation moved to West Nashville where it and other Jewish congregations continue today.",,Commerce Street and Seventh Avenue North,36.160872,-86.781604,POINT (-86.781604 36.160872)
130,2008,Buchanan Log House,James Buchanan (1763-1841) built this two-story single pen log house with hall and parlor plan c1807. The single pen log addition was added c1820 to accommodate the Buchanan family’s sixteen children. The house displays a high level of craftsmanship and is one of the best examples of two-story log construction in Middle Tennessee. The house was restored and placed in the National Register of Historic Places in 1984.,,Elm Hill Pike in front of Buchanan Log House,36.144776,-86.657683,POINT (-86.657683 36.144776)
159,2017,Centenary Methodist Institute,"Women from the Methodist Training School founded Warioto Settlement House in 1908. Renamed Centenary Methodist Institute, CMI moved to this location by 1921. CMI worked with rural migrant families in the North Nashville area called Kalb Hollow, providing a health care clinic and instruction in domestic skills and childcare. Children and teens participated in sports and clubs, directed for many years by Tom Page. CMI merged with Bethlehem Centers of Nashville in 1970.",,614/616 Monroe Street,36.176025,-86.791107,POINT (-86.791107 36.176025)
43,1971,Wallace University School 1886-1941,"To prepare young men for College & for life, believing the first object of education to develop character, the second to develop intellect, third to make Christian gentlemen, Wallace University School, directed by Professor Clarence B Wallace, flourished on this site, 1914-1941. Graduates entered universities without taking the usual examinations.",,"2000 block of West End Avenue, near 20th Avenue",36.151122,-86.79987,POINT (-86.79987 36.151122)
106,1999,Houston’s Law Office,"Sam Houston, a native of Virginia, moved to Nashville in 1818 to study law with Judge James Trimble. Admitted to the bar later that year, Houston practiced in Lebanon, Tenn., before returning to Nashville to serve as District Attorney (1819-21). In 1821, he opened a law office near this site. He was elected a U.S. Congressman (1823-27), Governor of Tenn. (1827-29), and President of the Republic of Texas (1836-38).",,Second Avenue North at the Criminal Justice Center,36.168273,-86.779056,POINT (-86.779056 36.168273)
166,2018,Paradise Ridge,"Named for the Paradise brothers, early settlers from North Carolina, this ridge was home to the Joelton Air Force Station from 1956-61, when the 799th Aircraft Control and Warning Squadron operated here as a part of the integrated continental defense system against aerial attacks from the Soviet Union. After the station closed, the radar equipment was updated and is still used as part of the FAA Joint Surveillance System. The Paradise Ridge Community Center opened here in 2013.",,3000 Morgan Rd.,36.335708,-86.85987,POINT (-86.85987 36.335708)
219,2020,Nashville Plan Schools/fehr School,"In Brown v. Topeka (1954) and Brown II (1955) the U.S. Supreme Court ordered public schools nationwide to end racial segregation “with all deliberate speed.” Nashville failed to comply, resulting in the Kelley v. Board of Education case (1955) and the 1957 enactment of a grade-per-year plan starting at the first grade. In 1963, the Maxwell v. Davidson County (1960) case was merged with the Kelley case. In 1998, the court deemed the Metro school system to be desegregated.

Named for local merchant and former Board of Education member Rudolph Fehr (1850-1916), Fehr School opened in 1924.  It was designed by architects Dougherty and Gardner. On Sept. 9, 1957, the school was desegregated by four African American first grade students.  Some 200 protestors surrounded the school, jeering as students entered.  Members of the Congress of Racial Equality (CORE) visited parents in the area, supporting those already enrolled and encouraging others to join them.",,1624 5th Avenue North,36.182016,-86.792274,POINT (-86.792274 36.182016)
7,1968,East Nashville Fire,"Nashville’s worst disaster by fire occurred Wednesday, March 22, 1916. It began at 11:47 a.m. in the rear of Seagraves Planing Mill, 80 yards west, and was swept eastwardly by 44 to 51 mph gales.  It was brought under control at 4:30 p.m. near So. Tenth and Dew Streets.  648 buildings were burned, 1 life lost and 3,000 people left homeless.",,211 North 1st Street,36.175227,-86.774227,POINT (-86.774227 36.175227)
54,1975,Montgomery Bell Academy,"Formerly established in 1867 with a bequest of $20,000 by ironmaster Montgomery Bell, the roots of M.B.A. actually go back to 1785, with the University of Nashville, Cumberland College, and Davidson Academy. The boy’s preparatory school has been here since 1915, when the Board of Trustees purchased Totomoi, the estate of Garland Tinsley.",,4001 Harding Road,36.130091,-86.838429,POINT (-86.838429 36.130091)
241,2022,Vine Hill,"William J. Gerst (of the Wm. Gerst Brewing Co.) purchased the Vine Hill estate in 1900 from Capt. John W. Morton for $14,195. In 1905 Gerst built a three-story barn and started rearing thoroughbreds. The local brewer/turfman’s prize horse, Donau, won the Kentucky Derby in 1910. The family sold the estate in 1941 to make way for Vultee Aircraft’s employee housing. The home was used as a community center for soldiers during WWII and later razed for government housing.",,Benton Avenue at Bransford Avenue,36.131562,-86.768561,POINT (-86.768561 36.131562)
103,1999,Julia Mcclung Green 1873-1961,"Dedicated educator who served Davidson County public schools 57 years as a teacher, the first Supervisor of Elementary Education 1911-1944 and Director of Character Education, Miss Julia oversaw schools countywide. A progressive, she pioneered school hot lunch and health programs for children, local affiliation with national education organizations, and the local PTA movement.",,3500 Hobbs Road,36.102314,-86.833419,POINT (-86.833419 36.102314)
67,1976,Waverly Place,"About 100 yards east stood Waverly, the home of A.W. Putnam, a writer and historian. The house was named for the Waverley Novels by Sir Walter Scott. Putnam sold Waverly in 1858, and in 1887 the land was conveyed to a real estate syndicate—the Waverly Land Co.  The land was subdivided into lots, and became a streetcar suburb serviced by the Waverly Place-Glendale Park line. Several of the streets—Grantland, White, and Ridley—are named for members of the land syndicate.",,760 Benton Avenue,36.132548,-86.77851,POINT (-86.77851 36.132548)
175,2018,Tennessee Hospital for the Insane,"In 1832, the Tenn. legislature approved the state’s first asylum, established in 1840 southwest of Nashville. The State bought this land in 1848, after activist-reformer Dorothea Dix and asylum staff called for improved facilities. Prominent architect Adolphus Heiman designed the Gothic-style complex with octagonal towers and separate wards. Opened in 1852 and renamed Central State Hospital in 1920, it closed in 1995. A stone gatehouse and unmarked graves are all that remain.",,2 Dell Parkway,36.107811,-86.677384,POINT (-86.677384 36.107811)
155,2013,Woman Suffrage Rallies,"Centennial Park was the site of May Day rallies held annually from 1914 until 1920, when the Tennessee General Assembly ratified the 19th Amendment to the U.S. Constitution, guaranteeing the right to vote to American women. Suffragists marched from the State Capitol to Centennial Park, where thousands gathered to hear speakers such as Anne Dallas Dudley, Maria Thompson Daviess, Sue Shelton White, and Abby Crawford Milton.",,"Centennial Park, along 28th Avenue North near Art Center",36.153343,-86.812373,POINT (-86.812373 36.153343)
212,2020,Betty Chiles Nixon,"Betty Nixon was a trailblazing woman in Nashville politics, an ardent preservationist, and a relentless advocate for the city’s people and neighborhoods. She served on the Metro Council from 1975 to 1987, was the first woman to chair its Budget and Finance Committee, and ran for mayor in 1987 and 1991. Nixon and her first husband, U.S. District Judge John T. Nixon, purchased this 1925 Colonial Revival house in 1971. It was the setting for her campaigns and community activism.",,1607 18th Ave S,36.138605,-86.796716,POINT (-86.796716 36.138605)
191,2019,Elizabeth Atchison Eakin 1858-1936,"Elizabeth Rhodes Atchison, born in Nashville on Feb. 26, 1858, married prominent banker John H. Eakin in 1882. Active in many civic causes, in 1917 she became the first woman to join the Nashville City School Board. After her death in 1936, a new school on Fairfax Ave., built with funds from the Works Progress Administration (WPA), was named in her honor. In 2006, Eakin School moved to the adjacent Cavert School. The Eakin Building became the Martin Center for teacher training.",,2500 Fairfax Avenue,36.134841,-86.807297,POINT (-86.807297 36.134841)
238,2021,Racial Terror Lynchings in America,"Thousands of African American men, women, and children were the victims of lynching and racial terror violence in the United States in the century following the end of the Civil War.  As the federal protection of the Reconstruction era ended, African Americans seeking equal rights suffered violent abuse and resistance from white supremacists, leading to decades of political, social and economic exploitation.  Jim Crow laws and threats of violence were used not only to deny African Americans their rights, but also to punish those who disobeyed the racial hierarchy.  Lynchings became the most public and notorious form of racial terrorism, intended to intimidate African Americans and enforce racial segregation.  These lynchings took place across the country and were perpetrated by people with no connection to one another, yet these rituals often included many of the same elements including abductions by a large mob (often from police custody), returning the victim to the scene of the alleged crime, stripping the victim to further inflict humiliation, and torture or mutilation.  Many of the names of lynching victims were not recorded and remain unknown, but over 200 documented lynchings took place in Tennessee alone, at least six having taken place in Davidson County.",,7236 Old Burkitt Road,35.992527,-86.68273,POINT (-86.68273 35.992527)
68,1976,Edmondson Home Site,"Will Edmondson, born about 1883 of former slave parents in the Hillsboro area of Davidson County, worked as a railroad and hospital laborer until 1931, when he began his primitive limestone carvings. Working without formal training, he produced some remarkable sculptures which won high praise in exhibits across the nation. He died in 1951.",,"Fourteenth Avenue South, north of Wade Avenue",36.137383,-86.790549,POINT (-86.790549 36.137383)
185,2019,Patsy Cline's Dream House,"This is the “dream house” of country music icon Patsy Cline, born Virginia Patterson Hensley in 1932. Roy Acuff offered her a job by the age of 16, but she opted to sing with a local group back home in Winchester, Va. She changed her name in 1953 and debuted on the Grand Ole Opry in 1955. She got her big break in 1957 singing “Walkin’ After Midnight” on Arthur Godfrey’s Talent Scouts. In 1973, she became the first female solo artist inducted into the Country Music Hall of Fame.",,815 Nella Drive,36.281195,-86.736146,POINT (-86.736146 36.281195)
40,1971,James Carroll Napier,"James C. Napier (1845-1940), Nashville Negro lawyer, educator, member of the city council, delegate to four Republican conventions, Register of U.S. Treasury, 1911-1915, was a trustee of Fisk, Howard, and Meharry, advocate of the public schools, and founder of the One-cent Savings Bank, later the Citizens Savings Bank and Trust Co.",,corner of Lafayette Street and Claiborne Street,36.148378,-86.761184,POINT (-86.761184 36.148378)
107,2001,Mount Pisgah Community,"In 1867, Jane Watson deeded land to several African-American families, many of them her former slaves. First called Watson Town, the community became known as Mt. Pisgah by 1871. The Methodist Episcopal Church North organized a church here in 1866 and bought an acre of land from William Holt in 1869 for a church and school building. The second church building, used 1916-1976, stood along the Owen & Winstead Pike, now Edmondson Pike.",,6245 Mount Pisgah Road (sign is located on Edmondson Pike side of the church),36.022362,-86.742623,POINT (-86.742623 36.022362)
170,2018,Eastland,"The Eastwood area, a suburb originally named Eastland in 1901, was laid out as the Brownsville plan in 1855, the land carved from the Weakley tract. Their c.1855 house remains at the northeast corner of Chapel and Greenwood.  Eastland Avenue, previously Vaughn’s Pike, was named for and led to a 19th century farm near the river. The old Eastland School, now Eastland Park, was acquired in 1953 by the Park Board and functioned as a community center until the building was demolished.",,1921 Greenwood Avenue,36.189347,-86.735033,POINT (-86.735033 36.189347)
217,2020,Bradley Studio Hillsboro Village,"Owen and Harold Bradley built and operated a one-story, concrete block recording studio on this site from 1953-55. “Queen of Country Music” Kitty Wells, bluegrass legends Bill Monroe and the Stanley Brothers, and popular vocalist Pat Boone—making his studio debut—were among the artists who recorded in the small studio behind this Hillsboro Village storefront. The structure later served as a school supply store and a ceramics studio. The buildings were demolished in 2014.",,1805 21st Avenue South,36.136155,-86.801139,POINT (-86.801139 36.136155)
