Number,Year Erected,Marker Name,Marker Text,Civil War Site?,Location,Latitude,Longitude,Mapped Location
120,2005,Randall Jarrell 1914-1965,"Distinguished poet, critic, novelist, and teacher. Born in Nashville; Hume-Fogg graduate 1931; Vanderbilt bachelor’s and master’s degrees. Served in U.S. Army Air Corps in World War II. Wrote about losses of war and childhood innocence. Poet Laureate at Library of Congress, 1956-58. Winner of National Book Award for poetry, 1960.",,"Hume-Fogg High School, 700 Broadway",36.159303,-86.781572,POINT (-86.781572 36.159303)
78,1982,Percy Warner Park 2058.1 Acres,"Percy Warner (1861-1927) was a pioneer in electric utilities and hydroelectric development in the South. As chairman of the Park Board, he expanded Nashville’s park system. Preservation of this natural area was one of his greatest civic projects. Named in his honor by the Park Board in 1927, this land constitutes the largest municipal park in Tennessee.",,Belle Meade Boulevard at Warner Park entrance,36.083058,-86.867129,POINT (-86.867129 36.083058)
94,1995,Votes for Women,"On August 18, 1920, Tennessee became the 36th state to ratify the 19th Amendment to the U.S. Constitution, thereby giving all American women the right to vote. After weeks of intense lobbying by national leaders, Tennessee passed the measure by one vote. The headquarters for both suffragists, wearing yellow roses,
 and anti-suffragists, wearing red roses, were in the Hermitage Hotel.",,Union Street and Capitol Boulevard,36.163758,-86.78287,POINT (-86.78287 36.163758)
215,2020,Lock 2 Park,"In 1888, the U.S. Army Corps of Engineers sought to make water travel on the Cumberland River easier by regulating water levels with a series of dams and locks. Construction on Lock 2 began in 1892, and the lock and dam were finished in 1907. The project ended in 1924 with only 15 of the planned 26 locks completed. Leased to Metro Parks since 1956, Lock 2 Park still contains the lock keeper's house, several outbuildings, a lock wall, and a river gauge on the concrete steps.",,Lock 2 Road,36.244216,-86.70192,POINT (-86.70192 36.244216)
127,2008,Una Community,"The Una community developed around the crossroads of Smith springs road and Old Murfreesboro Pike in the early 19th century. The local postmaster changed the community name from Rowesdale, or Rosedale, to Una in 1882, honoring a Peabody college student much loved by local residents. Home to schools, churches, a general store, and a service station, this bustling tightly-knit rural community was supplanted by suburban development by the end of the 20th century.",,Smith Springs Road and Old Murfreesboro Road,36.096776,-86.654516,POINT (-86.654516 36.096776)
209,2019,Olive Branch Missionary Baptist Church,"In 1871, District 6 school commissioners John Briley, Benjiah Gray and Jason Austin bought one acre of land from James Thompson for an African American school. In 1873, African American members of the Benevolent Society of Olive Branch No. 38 established Olive Branch Cemetery. Olive Branch Missionary Baptist Church (est. 1875) used the one-room school for services until the church was built. The church was re-built in 1971. Due to its condition, the school was demolished c. 1980.",,5988 Cane Ridge Road,36.005319,-86.639733,POINT (-86.639733 36.005319)
148,2013,W.r. Rochelle (1904-1989),"A graduate of Peabody College, William Rayburn Rochelle served as principal of Cohn High School from 1939 until his retirement in 1965. An innovative educator, he led Cohn in developing student government and was responsible for a state of the art music education program. Rochelle devoted his life to education and community service, especially to adults with intellectual disabilities. In 1968, he founded the Rochelle Center for disabled adults and their families.",,"Cohn School, 4805 Park Avenue",36.150993,-86.84525,POINT (-86.84525 36.150993)
17,1969,Chickasaw Treaty,"In 1783, Chickasaw chiefs met with white settlers at a spring 100 yards north and agreed on land rights—the Cumberland country for the settlers, the Tennessee River lands beyond the Duck River ridge for the Chickasaw. This tribe became firm friends of James Robertson and his people, but the settlement suffered many more raids by Cherokees and Creeks.",,Corner of Morrow Road and Terry Drive,36.163513,-86.863273,POINT (-86.863273 36.163513)
199,2019,Jewish Community Center Bombing,"At 8:07 p.m. on Sunday, March 16, 1958 a bomb exploded at the Jewish Community Center at 3500 West End Avenue. The JCC, which was located here from 1952-84, often hosted community meetings aimed at desegregating Nashville’s schools and communities based on the Jewish values of equality and justice for all. Rabbi William Silverman received a call from the “Confederate Underground” claiming responsibility for the bombing.  The JCC opened one day later to demonstrate its resilience.",,440 Greenway entrance at West End Avenue,36.136352,-86.822402,POINT (-86.822402 36.136352)
161,2017,Penny Campbell 1953-2014,"An activist for LGBT rights and advocate for people with mental health and housing issues, Campbell co-organized Tennessee’s delegation to the 1987 March on Washington for Lesbian & Gay Rights and Nashville's 1988 Pride parade at a time when many feared discrimination and violence. Daughter of civil rights activist Will Campbell, she was the lead plaintiff in Campbell v. Sundquist (1996), which overturned a law criminalizing private, consensual, sexual acts between same-sex adults.",,1615 McEwen Avenue,36.181223,-86.739831,POINT (-86.739831 36.181223)
14,1969,Nashville Centennial 1780-1880,"On April 24, 1880, Nashville began a month-long celebration of 100 years since the signing of the Cumberland Compact. Starting with a 100-gun salute at the Capitol, a procession of dignitaries, veterans, businesses and community groups paraded to the Centennial Exposition building here. The evening featured speeches, music and a grand display of fireworks. Vendors sold Centennial Medals bearing the likeness of the recently dedicated Capitol statue of Pres. Andrew Jackson.",,801 Broadway,36.158648,-86.782508,POINT (-86.782508 36.158648)
140,2011,Bradley Studios,"In 1955, brothers Owen and Harold Bradley built a recording studio in the basement of a house on this site. They added another studio here in an army Quonset Hut, producing hits by Patsy Cline, Red Foley, Brenda Lee, Marty Robbins, Sonny James, and others. Columbia Records purchased the studios in 1962. The studio established its reputation in the music industry with hits by stars including Johnny Cash, Bob Dylan, Roger Miller, George Jones, and Tammy Wynette.",,34 Music Square East,36.149432,-86.792024,POINT (-86.792024 36.149432)
56,1975,Devon Farm,"Home of John Davis, early surveyor, who came from N.C. to Nashville in 1788. Davis was an Indian fighter & scout in the State Militia until 1795. He settled on Big Harpeth in 1795-96 and that year built a 1½-story home of hand-made brick. The farm, named for Devon cattle bred here, has been owned by seven generations of Davis-Hicks descendants.",,Hwy 100 near Devon Farm entrance,,,
10,1968,Two Rivers Mansion,"Built in 1859 by David H. McGavock, this mansion stands on land inherited by McGavock’s wife, Willie, from her father, William Harding.  The smaller house to the left was built in 1802.  Dr. James Priestley’s Academy, established about 1816, was located on the 1,100 acre farm 1 mile from the mansion on the Cumberland River bluff.",,"In front of Two Rivers Mansion, 3130 McGavock Pike",36.189167,-86.674717,POINT (-86.674717 36.189167)
205,2019,Crieve Hall,"The Crieve Hall neighborhood was part of the over 2,000-acre estate of John Overton, on which he built Travellers Rest in 1799. Jesse M. Overton built an English Tudor-style house called Overton Hall near here in 1900. Mr. and Mrs. Herbert Farrell purchased the estate in 1925, expanded the home and extensive gardens, and renamed it Crieve Hall after the ancestral Farrell home in Northern Ireland. The house was razed in the 1950s, and Crieve Hall Elementary School opened in 1955.",,498 Hogan Road,36.065334,-86.757854,POINT (-86.757854 36.065334)
12,1969,Nashville’s First Public School,"Nashville’s first public school, Hume School, opened here Feb. 26, 1855.  A three story brick building, the school employed 12 teachers and served all grades.  In 1874 high school classes were moved to Fogg School built on adjoining corner lot. Named for educators, Alfred E. Hume & Francis B. Fogg, the schools were replaced by Hume-Fogg in 1912.",,"Hume-Fogg High School, 700 Broadway",36.159303,-86.781572,POINT (-86.781572 36.159303)
150,2013,Sylvan Park School,"A two-room frame school building was constructed here in 1907 to serve the children of newly-annexed West Nashville. Students in grades 1-8 attended here, and a second two-room building was added in 1909 for students in grades 1-4. Maria Wilson Hill served as first principal. In 1936, the Public Works Administration funded the construction of the current Art Deco building, designed by the architectural firm of Asmus and Clark.",,4801 Utah Avenue,36.144462,-86.844438,POINT (-86.844438 36.144462)
87,1992,Nashville Sit-ins,"Formerly located at this site was First Baptist Church, Capitol Hill, headquarters of the 1960s Sit-In Movement, led by Rev. Kelly Miller Smith. Strategy sessions, non-violence workshops, mass meetings, victory celebrations, and administrative offices were here. The well-disciplined Nashville Sit-Ins served as a model for civil rights demonstrations throughout the South.",,Eighth Avenue North and Charlotte Pike,36.164267,-86.785598,POINT (-86.785598 36.164267)
73,1981,Assumption Church,"Nashville’s second oldest Catholic church, dedicated Aug. 14, 1859, its rectory on right was added in 1874, school on left in 1879. The present altar, windows, and steeple were added later. The Germantown neighborhood grew around it; sermons were often in German until World War I. The parish has produced many nuns and priests including Archbishop John Floersh and Cardinal Stritch.",,1227 Seventh Avenue North,36.175457,-86.791303,POINT (-86.791303 36.175457)
100,1997,Central High School,"Founded in 1915 as the first public high school in the county system, Central High School stood here from 1921-1971. One of the earliest student government associations in the South began here. Many graduates became city and county political leaders. The last mayor of the old Nashville City Government, Ben West, and first Metro Government mayor, Beverly Briley, were classmates here.",,161 Rains Avenue,36.135195,-86.764707,POINT (-86.764707 36.135195)
80,1982,Edwin Warner Park 606.7 Acres,Edwin Warner (1870-1945) succeeded his brother Percy on the Park Board in 1927 and served for eighteen years. He personally directed the acquisition of most of the Warner Park acreage and supervised WPA development of the property. Warner organized a major Victory Garden program in the park during WWII. Park land west of Old Hickory Blvd. was renamed in his honor in 1937.,,Highway 100 at Edwin Warner Park entrance,36.061155,-86.911197,
18,1969,Johnson's Station,"In 1783, the State of North Carolina granted Cumberland Compact signer Isaac Johnson 640 ac. on Richland Creek. He settled near Johnson’s Lick, a spring on a buffalo path to the southwest. By 1787, a double log house and partially picketed cabins named Johnson’s Station stood here as a fort and tax collection site. Vacated in Jan. 1789, the station burned five months later. Charles Bosley, a wealthy member of the Nickajack Expedition and plantation owner, settled here in 1818.",,Harding Pike/ Memphis-Bristol Hwy and Vine Court,36.129886,-86.83927,POINT (-86.83927 36.129886)
116,2003,Tolbert Hollow,"George Tolbert, a farmer, bought 97½ acres here in 1879 that became known as Tolbert Hollow. He was a former slave who, according to family tradition, purchased his own freedom. Tolbert worked 45 acres by 1880 and cut and sold wood with his sons. Land ownership signified true freedom for blacks after the Civil War. Generations of Tolbert’s descendants continued to live on his land.",,"Tolbert Road, off of Old Hickory Boulevard",36.106301,-86.921666,POINT (-86.921666 36.106301)
29,1970,Madison College,"Madison College was founded in 1904 as Nashville Agricultural Normal Institute by Seventh-day Adventists on a farm of 412 acres. A sanitarium and campus industries were integral to the plan of work and study for students training for careers in agriculture, teaching, religion, industrial arts, nursing and allied health courses, and other fields.",,"Hospital Drive off of Neely's Bend Road, Madison",36.250601,-86.683705,POINT (-86.683705 36.250601)
1,1968,Heaton's Station,"Heaton’s Station (also called Old Heaton Station, Eaton Station, and Heatonsburg) was founded by Amos Heaton after arriving here with James Robertson in Dec. 1779. Stations founded by others in the surrounding area included: Fort Union, Freelands, Nashborough, Stones River, Mansker, Asher, and Bledsoe. By 1783, only two stations remained, Heaton and Nashborough. The Heaton family moved west in 1786 to New Heaton Station, along the present-day Eaton Creek area of Whites Creek.",,Lock Road at Seminary Street,36.201231,-86.788033,POINT (-86.788033 36.201231)
83,1987,Black Churches of Capitol Hill,"1. First Baptist Church, Capitol Hill (1848) 2. Gay Street Christian Church (1859) 3. Mount Olive Missionary Baptist Church (1887) 4. St. Andrews Presbyterian Church (1898) 5. St. John A.M.E. Church (1863) 6. Spruce Street Baptist Church (1848). These six churches stood within 1/6 mile of this marker.
 These six Black churches stood in the center of Nashville’s prosperous Black business district before the Capitol Hill Redevelopment Program. Several began before the Civil War as “missions” or Sunday School classes of earlier white churches. All boasted memberships of over 1,000 by 1910 and claimed the city’s most prominent Black business and professional families. All but one moved in the 1950s, and all continue to serve the Nashville community.",,"Charlotte Pike, between 10th Avenue North and YMCA Way (across from Avon Williams of TSU)",36.163648,-86.787207,POINT (-86.787207 36.163648)
184,2018,The Jungle and Juanita's,"Warren Jett opened The Jungle, a restaurant and cocktail bar, at 715 Commerce Street in 1952. Next door, Juanita Brazier opened Juanita's Place, a beer bar, in 1956. By the early 1960s, both were known as the first gay bars in Nashville. Jett sold The Jungle in 1960, after his brother, Leslie E. Jett, was elected sheriff. In 1963, 27 men were arrested for “disorderly behavior” in a raid at Juanita’s. Gay men continued to gather at both bars until 1983, when the block was leveled.",,715 Commerce Street,36.160541,-86.782123,POINT (-86.782123 36.160541)
50,1971,Eighth Avenue South Reservoir,"This 51 Mil. Gal. Reservoir was built 1887-89 on Kirkpatrick Hill, the site of Federal Fort Casino during Civil War. It is elliptical in shape with axes of 603 & 463.4 Ft. Perimeter of wall is 1,746 Ft. & water depth is 31 Ft. Rupture in east wall occurred at 12:10 A.M., Nov. 5, 1912. The interior was waterproofed in 1921. Designated as a National Water Landmark by AWWA, 1971.",,"8th Avenue South entrance to reservoir, wall marker",36.139105,-86.778629,POINT (-86.778629 36.139105)
46,1971,Hyde’s Ferry Turnpike,"Here was toll-gate No.2 of the Hyde's Ferry Turnpike Co., chartered in 1848 to build a road from Nashville to Ashland City and Sycamore Mills.  Richard Hyde's ferry crossed the Cumberland 2.6 mi. southeast, where the railroad bridge is now.  Davidson County paid $10,000 for its part of the road in 1901.  Cheatham County bought its portion and freed it from tolls in 1916.",,"Ashland City Highway/Hydes Ferry Road, between Cato Road and Eatons Creek Road",36.208951,-86.864173,POINT (-86.864173 36.208951)
149,2013,Holly Street Fire Hall,"Completed in 1914, J.B. Richardson Engine Company No. 14 was designed by Nashville’s first city architect, James B. Yeaman. Designed to blend in with the surrounding residential neighborhood, it was the first fire hall in the city built specifically for motorized fire trucks. Except for short periods during renovations, this fire hall has been in continuous use since its construction, and was listed in the National Register of Historic Places in 1982.",,1600 Holly Street,36.175477,-86.74195,POINT (-86.74195 36.175477)
213,2020,Clark Memorial United Methodist Church,"Founded in South Nashville in 1865, Clark Memorial moved to North Nashville in 1936 and to this location in 1945. The church was central to the Civil Rights movement in Nashville, with activist James M. Lawson conducting classes here in 1959 on non-violent protests. Lawson was a founding member of the Student Non-Violent Coordinating Committee (SNCC), whose Nashville members included students at American Baptist College, Fisk Univ., Tenn. A&I (now Tenn. State) and Vanderbilt Univ.",,1014 Fourteenth Avenue North,36.169135,-86.80008,POINT (-86.80008 36.169135)
181,2018,Logue House,"In 1786, the State of North Carolina deeded this land as part of a 640 acre grant to Revolutionary War Private and land surveyor James Mulherin. The c. 1920 stone American Foursquare dwelling was home to Gilbert Stroud Logue and Emma McEwan Logue. Gilbert was a professional Southern Circuit bicycle racer, a Scottish Rite 32nd degree Mason, and an investor in multiple businesses. Emma, a founding member of the Lebanon Road Garden Club, often hosted meetings at this estate.",,115 Cottage Lane,36.1681,-86.692215,POINT (-86.692215 36.1681)
3,1968,Site of First Store,"Lardner Clark, “Merchant and Ordinary Keeper,” came from Philadelphia, Penn. in the early 1780s with ten horses packed with goods to sell. He established Nashville’s first drygoods store by 1783, on a site 30 yards east. Clark sold calicoes, unbleached muslin, thimbles, pins, liquors, and provender for horses. Many customers traded pelts and furs for his goods. The building—which served as a store, tavern, and dwelling—faced south and was known as “the house with the piazza.”",,NE corner of Second Avenue North and Banks Street,36.165123,-86.777237,POINT (-86.777237 36.165123)
48,1971,Nashville General Hospital,"Opened on this site February 1890, with a capacity of 60 beds. Doctor Charles Brower of the University of Nashville Medical Department was appointed Superintendent. In 1891 a school of nursing was opened with Miss Charlotte E. Perkins as Superintendent. This was the first training school for nurses between the Ohio River and New Orleans.",,217 Middleton Street,36.157514,-86.765571,POINT (-86.765571 36.157514)
104,1999,Woodmont Estates,"Created in 1937 from the G. A. Puryear farm. It was once part of Samuel Watkin’s country estate. Olmsted Bros. Landscape Architects designed the roads and lots to flow naturally with the hills, valleys, and brook. Residential development was made possible by the 1915 construction of a concrete road. Known by 1918 as Woodmont Boulevard, it was the first documented concrete road in Tennessee.",,West Valley Brook and Bear Road,36.11428,-86.82394,POINT (-86.82394 36.11428)
157,2017,Surrender of Nashville Charles Fuller Home,"After Union success to north in TN and KY, Col. John Kennett, 4th Ohio Vol. Cavalry, ordered Cpt. H.C. Rodgers to Edgefield. They met with Nashville mayor R.B. Cheatham, Feb. 23, 1862, at the Edgefield home of banker Charles Fuller, to discuss terms of surrender. The city was conveyed to Federal control on Feb. 25. Fuller became a U.S. Treasury agent at the end of the war prior to his death in 1868. The Fuller home was destroyed in the East Nashville Fire of 1916.",X,"612 Woodland Street, East Park",36.17293,-86.761689,POINT (-86.761689 36.17293)
60,1975,Nashville Ymca,"On May 18, 1875, members of several Nashville churches gathered at the Christian Church (138 Vine Street) after a religious revival meeting and organized the Nashville Young Men’s Christian Association. Its first building, erected in 1886 on Church Street between Cherry and College, was destroyed by a fire in 1894. In 1912, it moved to its new eight-story building on Seventh and Union, which it occupied until 1972 when it moved to its present building, 1000 Church Street.",,1000 Church Street,36.161197,-86.785049,POINT (-86.785049 36.161197)
178,2018,Centenary United Methodist Church,"Rev. William Gower built the first Gower’s Chapel on his farm in 1805. A larger chapel, erected in 1850 on Gower land, also served as the local schoolhouse. On Oct. 5, 1884, the newly named Centenary Methodist Church was dedicated by Bishop Holland McTyeire. In 1922, the church relocated again. The new building was destroyed by a tornado on March 11, 1923, but was rebuilt within the year. Centenary United Methodist Church continues to worship at the same location on Gower Rd.",,6809 Gower Road,36.126892,-86.932021,POINT (-86.932021 36.126892)
114,2003,Germantown Historic District,"European immigrants established Germantown, the first suburb in North Nashville, in the 1850s. Large brick townhouses stood next to modest workers’ cottages, illustrating the area’s economic and social diversity. World War I and changes in public attitude began decades of decline. Renovation projects at two historic churches began the neighborhood’s revitalization in the 1970s. Germantown became a National Register Historic District in 1979.",,"Jefferson Street, between Sixth Avenue North and Seventh Avenue North",36.173883,-86.789012,POINT (-86.789012 36.173883)
144,2012,"Bmi Broadcast Music, Inc.","BMI (Broadcast Music, Inc.), an organization that collects performance royalties for songwriters and music publishers in all genres of music, opened its doors in New York in 1940. BMI was the first performance rights organization to represent what was then commonly referred to as rural and race music in the forms of country, gospel, blues, and jazz. In 1958, BMI established a permanent Nashville office and hired Frances Williams Preston as manager. BMI constructed the first wing of this building in 1964 and expanded it in 1995. This office represents songwriters and music publishers in Memphis, Atlanta, New Orleans, Muscle Shoals and Austin, and played a key role in developing Nashville as Music City, U.S.A.",,10 Music Square East,36.150756,-86.791786,POINT (-86.791786 36.150756)
206,2019,Percy Priest Lake,"Construction of the J. Percy Priest Dam and Reservoir began on June 2, 1963. The U.S. Army Corps of Engineers project was named for Priest, a teacher and Tennessean editor who served in Congress from 1940 until his death in 1956. Several small communities, like nearby Couchville, were destroyed during the creation of the lake. Dedicated on June 29, 1968, Percy Priest Dam generates Tenn. Valley Authority energy, and the 14,200-acre lake provides many recreational opportunities.",,3000 Smith Springs Road,36.087234,-86.60097,POINT (-86.60097 36.087234)
137,2009,The Craighead House,"This Federal-style home was built c1810 for John Brown Craighead and his first wife Jane Erwin Dickinson. Craighead was the son of early Nashville settler the Rev. Thomas Craighead. In 1823, Craighead married Lavinia Robertson Beck, youngest daughter of Nashville founders Charlotte and James Robertson. Major additions to the house were made in 1824, 1919, and 1998. Developers purchased the Craighead estate in 1905 and planned the present-day Richland-West End neighborhood.",,3710 Westbrook Avenue,36.138636,-86.830844,POINT (-86.830844 36.138636)
141,2011,Rca Studio B,"RCA Records established a recording studio in this building in November 1957, with local offices run by guitarist-producer Chet Atkins. Its success led to a larger studio, known as Studio A, built next door in 1964. Studio B recorded numerous hits by Elvis Presley, the Everly Brothers, Roy Orbison, Don Gibson, Charley Pride, Jim Reeves, Dolly Parton, and many others. Along with Bradley Studios, Studio B is known for developing “The Nashville Sound.”",,34 Music Square West,36.15013,-86.793178,POINT (-86.793178 36.15013)
15,1969,Powder-grinding Wheels,"These wheels used by the Confederacy to grind gunpowder at Augusta, Ga., in 1863-1864 were made in Woolwich, England and were shipped on the blockade runner “Spray,” via Mobile. After the war Gen. Miles purchased them for use at Sycamore Powder Mills, Cheatham County. They were exhibited at the Tennessee Centennial Exposition in 1897.",,"Near present position of wheels in Centennial Park, by Park Plaza entrance",36.153224,-86.81363,POINT (-86.81363 36.153224)
203,2019,Rev. Bill Barnes (1931-2017),"Reverend William L. “Bill” Barnes, a pastor, civil rights leader and teacher, was often called the “conscience of Nashville.” Rev. Barnes passionately agitated for legislation that would help those marginalized by race, social class, sexual orientation, incarceration or homelessness. He also founded many organizations to bring attention to those issues including MANNA (1975), Project Return (1979) and the Organized Neighbors of Edgehill (O.N.E.) Barnes Scholarship (1995).

In 1966 Rev. Barnes founded Edgehill United Methodist Church, one of Nashville’s first intentionally integrated churches. His work, addressing issues like affordable housing, often centered in the Edgehill community. Barnes wanted his work to be carried into the future, believing, much like Saint Óscar Romero, that “The temple shall remain unfinished until all are housed in dignity.” In 2013 The Barnes Housing Trust, the city’s affordable housing fund, was named in his honor.",,1502 Edgehill Avenue,36.143243,-86.790861,POINT (-86.790861 36.143243)
