Number,Year Erected,Marker Name,Marker Text,Civil War Site?,Location,Latitude,Longitude,Mapped Location
4,1968,Nashville Plow Works,"Site of a farm implement factory operated by Messrs. Sharp and Hamilton, previous to the War Between the States.  With the out-break of hostilities they reversed the Biblical injunction and produced swords of excellent quality for the Confederacy.  With the coming of the Federal Army, the making of swords was discontinued.",,SE corner of Eighth Avenue South and Palmer Place,36.153444,-86.779458,POINT (-86.779458 36.153444)
227,2020,History of Edgehill,"Edgehill’s history dates from the decades before the Civil War, when country estates were located on and around Meridian Hill, now E.S. Rose Park.  The construction and defense of Union fortifications during the Civil War drew many African Americans to the area, where they contributed to the Union victory and the end of enslavement.  After the Civil War, they built the free communities of “New Bethel” and “Rocktown” that developed during the twentieth century into Edgehill.",,1000 Edgehill Avenue,36.141977,-86.783459,POINT (-86.783459 36.141977)
133,2008,Richland-west End,"This early planned subdivision presents a largely unaltered picture of suburban residences in early 20th century Nashville. With ninety percent of existing homes built between 1905 and 1925, the styles range from large American foursquares to the more modest bungalows and cottages. The neighborhood is listed in the National Register of Historic Places.",,Bowling Avenue at Richland Avenue,36.1358,-86.825734,POINT (-86.825734 36.1358)
136,2009,Bells Bend,"Bells Bend, first known as White’s Bend, is an 18-square-mile area encompassed by a U-shaped bend in the Cumberland River. Numerous archaeological sites indicate that the area has been inhabited for at least 10,000 years. Bells Bend has thrived as an agricultural community since the early 19th century with land owners that included Montgomery Bell and David Lipscomb. The Clees family operated a mill and ferry service beginning in the 1870’s. Clees Ferry ceased operation in 1990.",,Old Hickory Blvd at Ashland City Highway,36.211694,-86.920493,POINT (-86.920493 36.211694)
151,2013,Richland Park,"Once a part of the Byrd Douglas plantation, the Nashville Land Improvement Company dedicated ten acres for a public park in 1887. After annexation, the park became a Nashville City Park in 1907, and the City added playground equipment. Richland Park hosted many community events such as ice cream socials, band concerts, outdoor movies, and sporting events. The commmunity center opened in 1932, and was converted in the Richland Park Library in 1961-62.",,"4711 Charlotte Avenue, in front of Richland Park Library",36.152004,-86.844134,POINT (-86.844134 36.152004)
69,1976,Tennessee State University,"Tennessee Agricultural & Industrial State Normal School for Negroes first opened its doors to 247 students in 1912. this site gave birth to a new era of public higher education for Negroes in the state of Tennessee with emphasis on agricultural & industrial occupations. In 1922 the school became a college & in 1951, a university.",,"TSU Campus, 3500 John A. Merritt Blvd, Hankal Hall",36.168229,-86.830118,POINT (-86.830118 36.168229)
239,2022,Woodmont School,"Woodmont School opened in 1931 on land purchased by area parents for $3000. Thousands of students attended in grades one through eight, and the school served as the hub of the community for the next 50 years. Many former students remember beloved teachers, principals and staff, and events such as spaghetti suppers, paper drives, field day events and annual carnivals. The school closed in 1982 and the building was razed in 1986. The campus became Woodmont Park in 1987.",,912 Estes Road,36.118588,-86.836043,POINT (-86.836043 36.118588)
169,2018,Alex Little Page Green (1806-1874),"In 1829, The Rev. Alex Green joined the Methodist Episcopal Church’s Nashville Conference. Elected vice-president of the TN Conference’s Temperance Society in 1835, Green was instrumental in the Southern Methodist Publishing House’s move to Nashville in 1854, and helped establish Shelby Medical College (1857) and Vanderbilt University (1875). By private venture, he opened Union St. from College St. to Market St. c. 1870. This area’s first school was renamed Alex Green Academy in 1887.",,3921 Lloyd Road,36.253871,-86.830129,POINT (-86.830129 36.253871)
58,1975,Fort Negley Site,"The guns of Fort Negley, commanding three turnpikes to the South & Southeast, opened the Battle of Nashville, Dec. 15, 1864. This site was selected by Capt. J.S. Morton as the key strongpoint in the Federal line around the city. The European style fort named for General James S. Negley, was built of stone, logs, earth and railway iron.",X,"Ridley Avenue, at Fort Negley entrance",36.142835,-86.775947,POINT (-86.775947 36.142835)
187,2019,Dodson School,"As early as 1815, school was held nearby at Stoner’s Lick Methodist Church. In 1843, early settler Timothy Dodson granted land for a dedicated schoolhouse that was built c. 1855. After it burned, classes were held at the Hermitage railroad station until a one-room frame school was rebuilt in 1880. Old Dodson School was built in 1936, expanded in 1950 and 1955; it was desegregated Jan. 23, 1961. Dodson School, designed by Nashville architect Earl Swensson, opened here in 1968.",,4401 Chandler Road,36.191264,-86.60361,POINT (-86.60361 36.191264)
148,2013,Cohn School,"Designed by architects Asmus and Clark and opened in 1928 as a junior high school, Cohn School was named in memory of Corinne Lieberman Cohn, one of the first female members of the school board.  Jonas H. Sikes served as first principal. The school added high school grades in 1937, and graduated its first high school class in 1940. Following school desegregation, Cohn High merged with Pearl High in 1983. The building now serves as the Cohn Adult Learning Center.",,"Cohn School, 4805 Park Avenue",36.150993,-86.84525,POINT (-86.84525 36.150993)
49,1971,Neill S. Brown 1810-1886,"Located 125 yards north is the site of Idlewild, home of Neill S. Brown, native of Giles County & fourteenth governor of Tennessee, 1848-1850. The only governor to live in East Nashville, he is credited with naming the city of Edgefield. Appointed United States Minister to Russia in 1850, and in 1870 was a member of the State Constitutional Convention.",,Main Street and Neill Avenue,36.175832,-86.757569,POINT (-86.757569 36.175832)
72,1981,Mansker’s First Fort,"Here on west bank of the creek that he discovered in 1772, Kasper Mansker and other first settlers built a log fort in 1779. John Donelson’s family fled here in 1780 for safety from Indians. Mansker abandoned the fort in 1781 and moved to Fort Nashborough. He returned in 1783, built a stronger stockade on east bank of the creek a half mile upstream, and lived there until he died in 1820.",,"Goodlettsville, on Long Hollow Pike between Northcreek Boulevard and Jackson Road",36.326921,-86.699867,POINT (-86.699867 36.326921)
247,2022,Tusculum Elementary School,"In 1911, after local families petitioned the county school board, Tusculum School opened on Nolensville Road. It was named for the nearby home of Judge John Haywood, after an area outside ancient Rome where nobles such as Cicero resided. The Works Progress Administration built a larger school on McMurray Drive in 1936. Razed in 1974 for a new building and replaced in 2017, Tusculum School became Tennessee’s first public school to receive a LEED Gold environmental designation.",,,,,
162,2018,Hca Healthcare,"In 1968, Hospital Corporation of America (HCA) was founded by Dr. Thomas Frist Sr., his son Dr. Thomas Frist Jr., and businessman Jack C. Massey. The original office was located here, in a small house near HCA’s first hospital—Park View. At the time, it was one of the nation’s first hospital companies. With a mission to care for and improve human life, the Nashville-based company, now called HCA Healthcare, has grown into one of the nation’s largest healthcare services providers.",,250 Twenty-Fifth Avenue North,36.152988,-86.81222,POINT (-86.81222 36.152988)
119,2004,The Temple Cemetery,"The Temple Cemetery was established in 1851 with the purchase of three acres by the Hebrew Benevolent Burial Association and still serves Nashville’s first Jewish congregation, The Temple, Congregation Ohabai Sholom. It blends early urban burial ground practices with picturesque elements of later Victorian garden cemeteries. The Temple Cemetery was listed in the National Register of Historic Places in 2004.",,"Temple Cemetery, 2001 15th Avenue North (inside cemetery)",36.183528,-86.810322,POINT (-86.810322 36.183528)
131,2008,Mud Tavern,"The Mud Tavern Community developed around the crossroads of the Elm Hill and McGavock Turnpikes. The name derives from the mud and log inn at the crossroads where early 19th century travelers found rest and refreshment. Mud Tavern later became a lively rural community, with a railway stop, schools, post office, and general store, which thrived until overtaken by 20th century commercial development.",,2200 Elm Hill Pike,36.152833,-86.689894,POINT (-86.689894 36.152833)
142,2011,Belmont-hillsboro Neighborhood,"When Adelicia Acklen’s estate was sold in 1890, the Belmont Mansion and its grounds became Belmont College. Other portions, and parts of the neighboring Sunnyside Mansion property, were subdivided into residential lots by the Belmont Land Co. In 1900-1910, streetcar lines were built running to Cedar Lane on Belmont Boulevard and to Blair Boulevard on 21st Ave. The neighborhood became a National Register Historic District in 1980.",,2500 Belmont Boulevard,36.125631,-86.794057,POINT (-86.794057 36.125631)
223,2020,Nashville Plan Schools/ Glenn School,"In Brown v. Topeka (1954) and Brown II (1955) the U.S. Supreme Court ordered public schools nationwide to end racial segregation “with all deliberate speed.” Nashville failed to comply, resulting in the Kelley v. Board of Education case (1955) and the 1957 enactment of a grade-per-year plan starting at the first grade. In 1963, the Maxwell v. Davidson County (1960) case was merged with the Kelley case. In 1998, the court deemed the Metro school system to be desegregated.

Named for Davidson County Judge and former Edgefield mayor William A. Glenn (1805-1883), the two-story, brick Glenn School opened in 1904. On Sept. 9, 1957, three African American first grade students desegregated the school. An agitated, jeering mob of white segregationists jostled students and parents. Members of the Congress of Racial Equality (CORE) visited area parents, supporting those already enrolled and encouraging others to join them. The school was replaced in 1988.",,322 Cleveland Street,36.186885,-86.766544,POINT (-86.766544 36.186885)
2,1968,Captain John Rains 1743-1834,"On Christmas Day 1779, John Rains led his family and livestock across the frozen Cumberland and settled in this vicinity. In 1784 he built a fort that enclosed this hill and the spring 75 yards east. At james Robertson's orders he often led a company of scouts against Indians. Rains made his home here until his death in 1834.",,SW corner of Rains Avenue and Merritt Street,36.13908,-86.76404,POINT (-86.76404 36.13908)
163,2018,Grandale,"Built in the 1830s, rebuilt in 1859, and expanded in 1880, Perry Dale Sr. and Alberta G. Dale purchased this two-story frame house in 1946, naming it GranDale. The one-story wings were added to each side in the 1970s. Between 1972 and 1973, Perry Sr. sold the house and the Dale Foods canning factory (now Cannery Row) to his two sons. The Dale sons sold GranDale in 1983, and in 1997 the house was moved 60 ft. from the original location at 2234 Murfreesboro Pike to save it from demolition.",,200 Nashboro Boulevard,36.088169,-86.646253,POINT (-86.646253 36.088169)
102,1997,Saint Thomas Hospital,"On April 11, 1898, at the request of Nashville Bishop Thomas Byrne, the Daughters of Charity opened Saint Thomas Hospital on this site in the former home of Judge J. M. Dickinson. Named for Byrne’s patron saint, the hospital began as a 26-bed “refuge for the sick,” opened a new building in 1902, operated a School of Nursing, and grew to 333 beds before moving in 1974 to 4220 Harding Road.",,Hayes Street betweenTwentieth Avenue North and Twentiest-First Awvenue North,36.15206,-86.800736,POINT (-86.800736 36.15206)
44,1971,Timothy Demonbreun,"Jacques-Timothe’ De Montbrun, born on Mar. 23, 1741, in Boucherville, Quebec, was the first white man to live in the Nashville area. Beginning in 1769, he spent several winters here trading for furs. He served as Lieut. Gov. of Illinois Country, 1783-86. He became permanent resident of Nashville in 1790, operating store & tavern. Died at home on this site, Oct. 30, 1826.",,"Third Avenue North, near intersection with Broadway, wall marker",36.161898,-86.776215,POINT (-86.776215 36.161898)
39,1971,Site of Original Gas Works,"The Nashville Gas Light Co., founded Mar. 1850, with General Washington Barrow, President, built first gas works in Tennessee for manufacturing gas from coal. First street lamp was lighted Feb. 13, 1851 at Second Ave. North and Public Square. First gas stove was used in 1894. Natural gas piped from Texas was first used in Nashville on August 5, 1946.",,800 Second Avenue North,36.171508,-86.78114,POINT (-86.78114 36.171508)
134,2008,"Battle of Nashville (december 16, 1864) Confederate Final Stand","After the withdrawal from the main Confederate line at Peach Orchard Hill, Lt. Gen. Stephen D. Lee formed a battle line across Franklin Pike 400 yards east of here with 200 men from the remnants of Brig. Gen. Henry Clayton’s division and two cannons from the Eufaula Light Artillery. This last line of defense halted the Federal pursuit for the night as the Confederate army retreated through the hills to the southwest.",X,827 Tyne Blvd,36.077687,-86.777135,POINT (-86.777135 36.077687)
28,1970,Granny White Grave,"Lucinda “Granny” White of N.C. acquired 50 acres of land near Brown’s Creek on Jan. 2, 1803.  In 1812, she opened a log tavern about 200 feet north of here near an old spring. Famous for its food and hospitality, Granny White’s inn stood along a stagecoach road that connected to the Natchez Trace.  She was buried here on her land in 1816. Granny White Pike was named after her in 1855.  The D.A.R. Gen. James Robertson Chapter restored her grave and added iron fencing in 1932.",,Travelers Ridge Drive off of Granny White Pike,36.073301,-86.807104,POINT (-86.807104 36.073301)
98,1996,Jackson’s Law Office,Andrew Jackson settled in Nashville in 1788 and served as Atty. Gen. until 1796. Lawyer John Overton owned a building here (1791-96) and shared office space with his friend Jackson. Jackson was Tennessee’s first Rep. to Congress (1796) and state Superior Court judge (1798-1804). He led U.S. troops to victory at the 1815 Battle of New Orleans and was elected President in 1828.,,"333 Union Street, wall marker",36.165176,-86.779571,POINT (-86.779571 36.165176)
135,2009,The Seeing Eye Independence and Dignity Since 1929,"The Seeing Eye, the world-famous dog guide training school, was incorporated in Nashville January 29, 1929, with headquarters in the Fourth and First National Bank Building at 315 Union St. Morris Frank, a 20-year-old blind man from Nashville, and his guide dog, Buddy, played a key role in the school’s founding and subsequent success. It was Frank who persuaded Dorothy Harrison Eustis to establish a school in the United States.",,Union Street at Third Avenue North,36.165579,-86.778611,POINT (-86.778611 36.165579)
216,2020,Brewery at Mill Creek,"Arthur Redmond, a European brewer who immigrated to Nashville in 1815, established a brewery and bakery on Chicken Pike, now Elm Hill Pike. Situated along the east side of Mill Creek near Foster’s and Buchanan’s mills, he brewed porter and ale and baked “ship bread” with barley purchased from local farmers. In 1819, Redmond was awarded a U.S. patent for “brewing improvements.” After his death in 1823, Paul Bianchi took over operations until closing in 1825.",,1631 Elm Hill Pike,36.144688,-86.71157,POINT (-86.71157 36.144688)
147,2013,Fehr School,"Named for local merchant and former school board member Rudolph Fehr, and designed by architects Dougherty and Gardner, Fehr School opened in 1924. On Sept. 9, 1957, Fehr became one of the first schools in Nashville to desegregate, admitting four African American first graders, who attended despite a hostile atmosphere. Some 200 protestors surrounded the school, and it received bomb threats prior to Hattie Cotton School being firebombed shortly after midnight on Sept. 10",,1624 Fifth Avenue North,36.182203,-86.792432,POINT (-86.792432 36.182203)
146,2012,Mary Catherine Schweiss Strobel (1912-1986),"Nashville native Mary Catherine Strobel was the first female employee of the Nashville Fire Department, serving from 1948 to 1977. She also devoted her life to helping the poor.  She lived in the family home, 1212 7th Avenue North, from 1938 to 1971.  Mary Catherine was murdered in Nashville on Dec. 9, 1986 in a random act of violence. In 1987, the community established the Mary Catherine Strobel Volunteer Awards to foster her giving spirit and her legacy of community service.",,1212 17th Avenue North (Germantown),36.174855,-86.790906,POINT (-86.790906 36.174855)
91,1993,St. Patrick Catholic Church,"Erected in 1890 and named for Ireland’s patron saint, this Second Empire style church was built to serve South Nashville’s growing Irish Catholic population. Until 1954, the Sisters of Mercy taught a grade school here. Since the 1890s, the Irish Travelers, a unique clan of American nomads, have come here periodically for weddings and funerals.",,1219 Second Avenue South,36.144594,-86.76395,POINT (-86.76395 36.144594)
236,2021,Vine Street Chirstian Church 138 N. Vine St.,"Vine Street Christian Church (Disciples of Christ) traces its beginning to 1820 and the Baptist Church of Nashville. Formally founded eight years later, with 218 members, the church met near this site in an 1821 building on Church Street, then in 1889 moved to 138 North Vine Street (now Seventh Avenue North.) In 1957, the church moved to Harding Pike, where the historic congregation continues its ecumenical witness in the city and beyond.",,701 Church Street,36.161827,-86.782375,POINT (-86.782375 36.161827)
195,2019,Nashville School of Law,"Founded in 1911 by the Young Men’s Christian Association, the Nashville YMCA Night Law School was created to make legal education accessible to working-class people. The School shared space on the 3rd floor of the YMCA at 7th & Union with the John Hill Eakin Educational Institute and moved to the basement of the Church St. YMCA before moving to its own campus in 1991. Renamed the Nashville School of Law in 1986, it is the only remaining independent law school created by the YMCA.",,899 Church Street,,,
145,2012,Scarritt College for Christian Workers,"Established in Kansas City in 1892 by the Methodist Episcopal Church South and moved to Nashville in 1924, Scarritt trained laity in Christian education, music, and missions until it closed in 1988. Much of the Collegiate Gothic campus architecture was designed by Nashville architect Henry C. Hibbs.  The campus was listed in the National Register of Historic Places in 1982. A leader in racial integration in the South, Scarritt integrated its student population in 1952. The Rev. Martin Luther King, Jr. spoke in Wightman Chapel to the Conference on Christian Faith and Human Relations on April 25, 1957. From its beginning, Scarritt had an international student population that reflected its commitment to a global understanding of racial justice and equality. Its mission and vision continue today through the Scarritt-Bennett Center.",,"In front of Wightman Chapel, 1008 19th Avenue North",36.145991,-86.797257,POINT (-86.797257 36.145991)
112,2003,Tanglewood Historic District,"The Tanglewood Historic District is a rustic style suburban development from the 1920-1940s built by Robert M. Condra, a prominent Nashville builder. Natural materials are featured in this popular Arts and Crafts substyle that harmonizes with the landscape. Tanglewood is located at the site of a late 1700s settlement known as Haysborough.",,"4908 Tanglewood Drive North, Madison",36.234956,-86.716818,POINT (-86.716818 36.234956)
218,2020,The Rock Block,"One of Nashville’s oldest streets, Elliston Place was a popular commercial corridor by 1930.  Elliston Place Soda Shop opened in 1939.  In 1971 Owsley Manier and Brugh Reynolds opened the listening-room style music venue Exit/In, named for its main rear entrance. In the early 1980s the area became known as “The Rock Block,” with businesses like The End, TGI Friday’s, Obie’s Pizza, The Gold Rush and Mosko’s shaping Elliston Place’s legacy as Nashville’s counterculture epicenter.",,2208 Elliston Place,36.151254,-86.804396,POINT (-86.804396 36.151254)
92,1994,Captain Ryman’s Home,"On this site stood the residence of Captain Thomas Green Ryman, owner of the Ryman steamboat line and builder of the Union Gospel Tabernacle, renamed Ryman Auditorium after his death in 1904. The Queen Anne frame house with a slate roof, seven gables and two turrets, served as the home of Captain and Mrs. Ryman and their seven children from 1885-1926. The house was razed in 1940.",,500 2nd Avenue South,36.155804,-86.771243,POINT (-86.771243 36.155804)
242,2022,Dr. Josie Wells,"Josie Wells came to Nashville in 1900 to attend Meharry Medical College of Walden University. One of three women graduates in 1904, she specialized in caring for women and children. She held free clinics for needy families, regardless of race. Wells was the campus physician at Fisk University, the first woman on the Meharry faculty, was instrumental in fundraising for Hubbard Hospital and became hospital superintendent in 1912.",,1005 Dr. D.B. Todd Boulevard,36.167057,-86.805801,POINT (-86.805801 36.167057)
192,2019,Cockrill Bend,"In 1786, the State of N.C. granted Gen. James Robertson several large tracts of land in this area. Robertson’s Bend was renamed after the Cockrill family who established several farms and a mill here before the Civil War. The Romanesque-style third Tenn. State Penitentiary, designed by Chattanooga architect S.M. Patton, was built from 1893-97 and had 50 buildings. It closed in 1992. Ford Glass Plant opened in 1956 as one of the world’s largest automobile glass manufacturers.",,Centennial Boulevard at Bomar Boulevard,36.171287,-86.862782,POINT (-86.862782 36.171287)
55,1975,Woodbine,"An early settler of this area was James Menees, at whose home Mill Creek Baptist Church was formed in 1797. James Whitsitt, first pastor, served over 50 years. Earlier known as Flat Rock, in 1939 this place was renamed Woodbine, after the David Hughes Estate once located on Nolensville Road. In 1919 the L&N RR began operation of Radnor Yards.",,"Nolensville Road, between Joyner Avenue and Whitsett Road (across the street from Woodbine Methodist Church)",36.115696,-86.747595,POINT (-86.747595 36.115696)
235,2021,Gerst House,"William J. Gerst opened the Gerst House restaurant in 1955, a year after the Wm. Gerst Brewing Co. closed. Serving German-American food, it was a gathering place for attorneys, journalists and politicians due to its proximity to the courthouse. Bill died in 1968; his daughter, Gene Ritter, continued the tradition. In 1970, urban development forced the Gerst House to move across the river. After Gene's death in 1988, it was sold and renamed the ""Gerst Haus."" It closed in 2018.",,Union Avenue at Second Avenue North,36.166056,-86.778051,POINT (-86.778051 36.166056)
229,2020,Dudley Park,"Originally known as Chestnut Street Park, land for this South Nashville park was purchased in 1913. That same year, two daughters of Parks Commission chairman Robert M. Dudley—Louise and Rebecca—died in a train accident in Iowa. The park was renamed in their memory in 1914. Baseball fields and a swimming pool were added in 1920, and the Works Progress Administration built a community center in the 1930s. The park often hosted weekly concerts and movie nights in addition to sports.",,1201 Third Avenue South,36.143573,-86.764641,POINT (-86.764641 36.143573)
156,2016,Music Row,"The heart of Nashville's music business, Music Row began in 1955, when Owen Bradley opened the Quonset Hut, the first recording studio here. In 1957, Chet Atkins opened RCA's studio at the corner of 17th and Hawkins. Other studios, publishing houses, and record labels including Columbia, Epic, Decca, Warner Bros, Capitol, and Curb followed with offices here. Street names were changed in 1975 to Music Square East and West.                                                                                                               Donated by Mike Curb Family Foundation",,"Owen Bradley Park, 1 Music Square East",36.151803,-86.792075,POINT (-86.792075 36.151803)
65,1976,General Thomas Overton 1753-1824,"Gen. Thomas Overton served in the Revolutionary War and as Inspector of Revenue in N.C., the same position held by his brother Judge John Overton in Tenn. He was one of Gen. Jackson’s seconds in duel with Chas. Dickinson. This grave plot was a part of his homeplace, “Soldier’s Rest,” where he lived from 1804 until his death in 1824.",,"Donelson Avenue west of Bryan Street, Old Hickory",36.264147,-86.651195,POINT (-86.651195 36.264147)
